{
    "$schema": "http://json-schema.org/draft-04/schema#",
    "title": "Collection",
    "type": "object",
    "allOf": [{"$ref": "container.json"}],
    "properties": {
        "_id": {},
        "created": {},
        "modified": {},
        "permissions": {},
        "files": {},
        "public": {},
        "label": {},
        "tags": {},
        "metadata": {},

        "curator": {"type": "string"}
    },
    "additionalProperties": false
}
